{
  "snapshot_schema_version": "1.0.0",
  "generated_at": "2026-10-01T23:52:47.435329+00:00",
  "as_of_date": "2026-10-02",
  "project_id": "SYS-AUTO-SAMPLE-HR-RESUME-SCREENING-01",
  "baseline_version_pin": "unknown",
  "applied_overlays": [],
  "total_active_controls": 43,
  "controls": {
    "ORG-CTL-ACC-001": {
      "id": "ORG-CTL-ACC-001",
      "title": "Mandatory AI System Registration in Central Inventory",
      "domain": "accountability_inventory",
      "type": "universal",
      "lifecycle_stages": [
        "concept_design",
        "deployment_admission"
      ],
      "enforcement_points": [
        "ci_build_pipeline",
        "deployment_admission_controller",
        "manual_audit_gate"
      ],
      "check_type": "hybrid",
      "mode": "blocking",
      "parameters": {},
      "evidence_required": [
        {
          "artifact_type": "inventory_registration_record",
          "description": "Central inventory entry metadata containing assigned permanent SYS-ID, business purpose, and owner verification.",
          "format": "json",
          "retention_period_years": 7
        }
      ],
      "exception_eligibility": {
        "eligible": false,
        "statutory_prohibition": true,
        "minimum_compensating_controls": [
          "No exceptions permitted. Operating uncatalogued AI systems is strictly prohibited."
        ]
      },
      "applied_overlays": [],
      "active_exception": null
    },
    "ORG-CTL-ACC-002": {
      "id": "ORG-CTL-ACC-002",
      "title": "Accountable System Ownership and Role Designation",
      "domain": "accountability_inventory",
      "type": "universal",
      "lifecycle_stages": [
        "concept_design",
        "deployment_admission",
        "runtime_operation"
      ],
      "enforcement_points": [
        "ci_build_pipeline",
        "deployment_admission_controller",
        "periodic_automated_scan"
      ],
      "check_type": "automated",
      "mode": "blocking",
      "parameters": {},
      "evidence_required": [
        {
          "artifact_type": "ownership_attestation_record",
          "description": "Directory validation confirming active corporate email addresses and roles for Business Owner and Technical Lead.",
          "format": "json",
          "retention_period_years": 5
        }
      ],
      "exception_eligibility": {
        "eligible": true,
        "statutory_prohibition": false,
        "minimum_compensating_controls": [
          "Temporary assignment of divisional engineering VP as interim custodian during owner transitions (max 30 days)."
        ]
      },
      "applied_overlays": [],
      "active_exception": null
    },
    "ORG-CTL-ACC-003": {
      "id": "ORG-CTL-ACC-003",
      "title": "Project Governance Manifest Schema Conformance",
      "domain": "accountability_inventory",
      "type": "universal",
      "lifecycle_stages": [
        "concept_design",
        "integration_ci_cd",
        "deployment_admission"
      ],
      "enforcement_points": [
        "pre_commit_hook",
        "pull_request_check",
        "ci_build_pipeline",
        "deployment_admission_controller"
      ],
      "check_type": "automated",
      "mode": "blocking",
      "parameters": {},
      "evidence_required": [
        {
          "artifact_type": "manifest_validation_report",
          "description": "Automated schema validation log confirming zero JSON Schema errors against schemas/project-manifest.schema.json.",
          "format": "json",
          "retention_period_years": 5
        }
      ],
      "exception_eligibility": {
        "eligible": false,
        "statutory_prohibition": false,
        "minimum_compensating_controls": [
          "No exceptions permitted. The manifest is the primary declarative contract required for all automated governance resolution."
        ]
      },
      "applied_overlays": [],
      "active_exception": null
    },
    "ORG-CTL-CST-001": {
      "id": "ORG-CTL-CST-001",
      "title": "Mandatory Project Token Budgets and Hard Spending Caps",
      "domain": "cost_resource_limits",
      "type": "universal",
      "lifecycle_stages": [
        "integration_ci_cd",
        "deployment_admission",
        "runtime_operation"
      ],
      "enforcement_points": [
        "ci_build_pipeline",
        "deployment_admission_controller",
        "api_gateway_sidecar"
      ],
      "check_type": "automated",
      "mode": "blocking",
      "parameters": {},
      "evidence_required": [
        {
          "artifact_type": "finops_budget_allocation_record",
          "description": "FinOps ledger record confirming approved monthly budget and active gateway token-tracking quota tag.",
          "format": "json",
          "retention_period_years": 5
        }
      ],
      "exception_eligibility": {
        "eligible": true,
        "statutory_prohibition": false,
        "minimum_compensating_controls": [
          "Temporary emergency quota expansion approved by Finance Business Partner."
        ]
      },
      "applied_overlays": [],
      "active_exception": null
    },
    "ORG-CTL-CST-002": {
      "id": "ORG-CTL-CST-002",
      "title": "Per-User and Per-Client Inference Rate Limiting",
      "domain": "cost_resource_limits",
      "type": "universal",
      "lifecycle_stages": [
        "deployment_admission",
        "runtime_operation"
      ],
      "enforcement_points": [
        "deployment_admission_controller",
        "api_gateway_sidecar"
      ],
      "check_type": "automated",
      "mode": "blocking",
      "parameters": {},
      "evidence_required": [
        {
          "artifact_type": "rate_limiting_conformance_audit",
          "description": "Automated test report verifying that burst traffic exceeding per-user RPM/TPM quotas returns HTTP 429 Too Many Requests.",
          "format": "json",
          "retention_period_years": 3
        }
      ],
      "exception_eligibility": {
        "eligible": true,
        "statutory_prohibition": false,
        "minimum_compensating_controls": [
          "Dedicated isolated compute pool with private API key for approved high-volume batch jobs."
        ]
      },
      "applied_overlays": [],
      "active_exception": null
    },
    "ORG-CTL-CST-004": {
      "id": "ORG-CTL-CST-004",
      "title": "Semantic Caching and Architectural Model Right-Sizing",
      "domain": "cost_resource_limits",
      "type": "universal",
      "lifecycle_stages": [
        "concept_design",
        "integration_ci_cd",
        "runtime_operation"
      ],
      "enforcement_points": [
        "ci_build_pipeline",
        "api_gateway_sidecar",
        "manual_audit_gate"
      ],
      "check_type": "hybrid",
      "mode": "advisory",
      "parameters": {},
      "evidence_required": [
        {
          "artifact_type": "model_efficiency_and_caching_audit",
          "description": "FinOps architecture review confirming high-volume repetitive queries utilize caching and model tier matches task complexity requirements.",
          "format": "markdown",
          "retention_period_years": 3
        }
      ],
      "exception_eligibility": {
        "eligible": true,
        "statutory_prohibition": false,
        "minimum_compensating_controls": [
          "Documented business justification explaining why caching cannot be used (e.g. strict zero-persistence requirement)."
        ]
      },
      "applied_overlays": [],
      "active_exception": null
    },
    "ORG-CTL-DAT-001": {
      "id": "ORG-CTL-DAT-001",
      "title": "Training and Retrieval Dataset Lineage and Data Card Verification",
      "domain": "data_quality_privacy_retention",
      "type": "universal",
      "lifecycle_stages": [
        "data_preparation",
        "model_training",
        "integration_ci_cd"
      ],
      "enforcement_points": [
        "ci_build_pipeline",
        "model_registry_admission",
        "manual_audit_gate"
      ],
      "check_type": "hybrid",
      "mode": "blocking",
      "parameters": {},
      "evidence_required": [
        {
          "artifact_type": "attested_data_card",
          "description": "Completed Data Card adhering to templates/data-card.md documenting source lineage, curation pipeline, consent basis, and license terms.",
          "format": "markdown",
          "retention_period_years": 7
        }
      ],
      "exception_eligibility": {
        "eligible": true,
        "statutory_prohibition": false,
        "minimum_compensating_controls": [
          "Use restricted to sandboxed research environment with synthetic surrogate data only."
        ]
      },
      "applied_overlays": [],
      "active_exception": null
    },
    "ORG-CTL-DAT-002": {
      "id": "ORG-CTL-DAT-002",
      "title": "Automated Runtime PII Detection and Sanitization",
      "domain": "data_quality_privacy_retention",
      "type": "conditional",
      "lifecycle_stages": [
        "integration_ci_cd",
        "deployment_admission",
        "runtime_operation"
      ],
      "enforcement_points": [
        "ci_build_pipeline",
        "deployment_admission_controller",
        "api_gateway_sidecar"
      ],
      "check_type": "automated",
      "mode": "blocking",
      "parameters": {},
      "evidence_required": [
        {
          "artifact_type": "pii_redaction_verification_report",
          "description": "Automated test suite report verifying that synthetic test payloads containing synthetic PII (SSN, credit card, email, phone) are 100% sanitized before egress.",
          "format": "json",
          "retention_period_years": 5
        }
      ],
      "exception_eligibility": {
        "eligible": true,
        "statutory_prohibition": false,
        "minimum_compensating_controls": [
          "Model runs in dedicated, enterprise-isolated tenant with customer BAA/DPA and zero retention agreement; egress strictly blocked to external cloud."
        ]
      },
      "applied_overlays": [],